{
  "recipe": "1",
  "name": "photo-slideshow",
  "about": "Photos with slow zooms and pans, joined by soft fades, a title on the first photo and a warm tint.",
  "output": { "ratio": "9:16", "res": 1080, "fps": 30 },
  "maxDuration": 30,
  "sections": [
    {
      "role": "body",
      "about": "photos (or short video clips)",
      "fit": "cover",
      "shot": 3,
      "motion": "alternate",
      "join": { "type": "fade", "duration": 0.5 },
      "texts": [
        { "slot": "title", "style": "title", "y": 0.82, "end": 2.6, "in": { "type": "up" }, "out": { "type": "fade" } }
      ]
    }
  ],
  "texts": [
    { "slot": "cta", "style": "box-yellow", "y": 0.82, "fromEnd": 2 }
  ],
  "music": { "volume": 80, "fadeIn": 0.5, "fadeOut": 1 },
  "filters": [ { "name": "warm", "amount": 50 } ]
}
